Question,Question Text,A,B,C,D,E,Your Answer,Correct,Points,Domain
Q50,A solutions architect is optimizing a website for an upcoming musical event. Videos of the performances will be streamed in real time and then will be available on demand. The event is expected to attract a global online audience. Which service will improve the performance of both the real-time and on-demand streaming?,Amazon CloudFront,AWS Global Accelerator,Amazon Route 53,Amazon S3 Transfer Acceleration,,,A,"=IF(H51=I51,1,0)",Design High-Performing Architectures
Q51,"A company wants to create a mobile app that allows users to stream slow-motion video clips on their mobile devices. Currently, the app captures video clips and uploads the video clips in raw format into an Amazon S3 bucket. The app retrieves these video clips directly from the S3 bucket. However, the videos are large in their raw format. Users are experiencing issues with buffering and playback on mobile devices. The company wants to implement solutions to maximize the performance and scalability of the app while minimizing operational overhead. Which combination of solutions will meet these requirements? (Choose two.) S3 buckets. formats. content delivery and caching. files to more appropriate formats. 187 Global IT Certification Hub",Deploy Amazon CloudFront for content delivery and caching.,Use AWS DataSync to replicate the video files across AW'S Regions in other,Use Amazon Elastic Transcoder to convert the video files to more appropriate,Deploy an Auto Sealing group of Amazon EC2 instances in Local Zones for,Deploy an Auto Scaling group of Amazon EC2 instances to convert the video,,A,"=IF(H52=I52,1,0)",Design High-Performing Architectures
Q52,"A company has a three-tier web application that processes orders from customers. The web tier consists of Amazon EC2 instances behind an Application Load Balancer. The processing tier consists of EC2 instances. The company decoupled the web tier and processing tier by using Amazon Simple Queue Service (Amazon SQS). The storage layer uses Amazon DynamoDB. At peak times, some users report order processing delays and halls. The company has noticed that during these delays, the EC2 instances are running at 100% CPU usage, and the SQS queue fills up. The peak times are variable and unpredictable. The company needs to improve the performance of the application. Which solution will meet these requirements? processing tier instances for the duration of peak usage times. Use the CPU Utilization metric to determine when to scale. target utilization as a metric to determine when to scale. Use HTTP latency as a metric to determine when to scale. 637 Global IT Certification Hub processing tier instances. Use the ApproximateNumberOfMessages attribute to determine when to scale.",Use scheduled scaling for Amazon EC2 Auto Scaling to scale out the,Use Amazon ElastiCache for Redis in front of the DynamoDB backend tier. Use,Add an Amazon CloudFront distribution to cache the responses for the web tier.,Use an Amazon EC2 Auto Scaling target tracking policy to scale out the,,,D,"=IF(H53=I53,1,0)",Design High-Performing Architectures
Q53,A company is running a highly sensitive application on Amazon EC2 backed by an Amazon RDS database. Compliance regulations mandate that all personally identifiable information (PII) be encrypted at rest. Which solution should a solutions architect recommend to meet this requirement with the LEAST amount of changes to the infrastructure? encrypt the database volume. database volumes. keys to encrypt database volumes. RDS encryption with AWS Key Management Service (AWS KMS) keys to encrypt instance and database volumes. 523 Global IT Certification Hub,Deploy AWS Certificate Manager to generate certificates. Use the certificates to,"Deploy AWS CloudHSM, generate encryption keys, and use the keys to encrypt",Configure SSL encryption using AWS Key Management Service (AWS KMS),Configure Amazon Elastic Block Store (Amazon EBS) encryption and Amazon,,,D,"=IF(H54=I54,1,0)",Design Secure Architectures
Q54,"A company manages AWS accounts in AWS Organizations. AWS IAM Identity Center (AWS Single Sign-On) and AWS Control Tower are configured for the accounts. The company wants to manage multiple user permissions across all the accounts. The permissions will be used by multiple IAM users and must be split between the developer and administrator teams. Each team requires different permissions. The company wants a solution that includes new users that are hired on both teams. Which solution will meet these requirements with the LEAST operational overhead? separate developer and administrator groups in IAM Identity Center. Assign the 427 Global IT Certification Hub users to the appropriate groups. Create a custom IAM policy for each group to set fine-grained permissions. separate developer and administrator groups in IAM Identity Center. Assign the users to the appropriate groups. Attach AWS managed IAM policies to each user as needed for fine-grained permissions. on administrator groups in IAM Identity Center. Create new permission sets that include the appropriate IAM policies for each group. Assign the new groups to the appropriate accounts. Assign the new permission sets to the new groups. When new users are hired, add them to the appropriate group. include the appropriate IAM policies for each user. Assign the users to the appropriate accounts. Grant additional IAM permissions to the users from within specific accounts. When new users are hired, add them to IAM Identity Center and assign them to the accounts.",Create individual users in IAM Identity Center for each account. Create,Create individual users in IAM Identity Center for each account. Create,Create individual users in IAM Identity Center. Create new developer and,Create individual users in IAM Identity Center. Create new permission sets that,,,C,"=IF(H55=I55,1,0)",Design Secure Architectures
Q55,"A company stores data in an Amazon Aurora PostgreSQL DB cluster. The company must store all the data for 5 years and must delete all the data after 5 years. The company also must indefinitely keep audit logs of actions that are performed within the database. Currently, the company has automated backups 96 Global IT Certification Hub configured for Aurora. Which combination of steps should a solutions architect take to meet these requirements? (Choose two.) Hub",Take a manual snapshot of the DB cluster.,Create a lifecycle policy for the automated backups.,Configure automated backup retention for 5 years.,Configure an Amazon CloudWatch Logs export for the DB cluster.,Use AWS Backup to take the backups and to keep the backups for 5 years.,,DE,"=IF(H56=I56,1,0)",Design Resilient Architectures
Q56,A company runs an ecommerce application on Amazon EC2 instances behind an Application Load Balancer. The instances run in an Amazon EC2 Auto Scaling group across multiple Availability Zones. The Auto Scaling group scales based on CPU utilization metrics. The ecommerce application stores the transaction data in a MySQL 8.0 database that is hosted on a large EC2 instance. The database's performance degrades quickly as application load increases. The application handles more read requests than write transactions. The company wants a solution that will automatically scale the database to meet the demand of unpredictable read workloads while maintaining high availability. Which solution will meet these requirements? reader instances in a different Availability Zone. Scaling with Aurora Replicas.,Use Amazon Redshift with a single node for leader and compute functionality.,Use Amazon RDS with a Single-AZ deployment Configure Amazon RDS to add,Use Amazon Aurora with a Multi-AZ deployment. Configure Aurora Auto,Use Amazon ElastiCache for Memcached with EC2 Spot Instances.,,,C,"=IF(H57=I57,1,0)",Design Resilient Architectures
Q57,"A company is migrating a three-tier application to AWS. The application requires a MySQL database. In the past, the application users reported poor application performance when creating new entries. These performance issues were caused by users generating different real-time reports from the application during working hours. Which solution will improve the performance of the application when it is moved to AWS? Refactor the application to use DynamoDB for reports. compute resources exceed the on-premises database. replicas. Configure the application to use the reader endpoint for reports. application to use the backup instance of the cluster as an endpoint for the reports.",Import the data into an Amazon DynamoDB table with provisioned capacity.,Create the database on a compute optimized Amazon EC2 instance. Ensure,Create an Amazon Aurora MySQL Multi-AZ DB cluster with multiple read,Create an Amazon Aurora MySQL Multi-AZ DB cluster. Configure the,,,C,"=IF(H58=I58,1,0)",Design Resilient Architectures
Q58,"A company uses Amazon EC2 instances and AWS Lambda functions to run its application. The company has VPCs with public subnets and private subnets in its AWS account. The EC2 instances run in a private subnet in one of the VPCs. The Lambda functions need direct network access to the EC2 instances for the application to work. The application will run for at least 1 year. The company expects the number of Lambda functions that the application uses to increase during that time. The company wants to maximize its savings on all application resources and to keep network latency between the services low. Which solution will meet these requirements? duration and memory usage and the number of invocations. Connect the Lambda functions to the private subnet that contains the EC2 instances. 259 Global IT Certification Hub duration and memory usage, the number of invocations, and the amount of data that is transferred. Connect the Lambda functions to a public subnet in the same VPC where the EC2 instances run. and memory usage, the number of invocations, and the amount of data that is transferred. Connect the Lambda functions to the private subnet that contains the EC2 instances. and memory usage, the number of invocations, and the amount of data that is transferred. Keep the Lambda functions in the Lambda service VPC.",Purchase an EC2 Instance Savings Plan Optimize the Lambda functions',Purchase an EC2 Instance Savings Plan Optimize the Lambda functions',Purchase a Compute Savings Plan. Optimize the Lambda functions' duration,Purchase a Compute Savings Plan. Optimize the Lambda functions' duration,,,C,"=IF(H59=I59,1,0)",Design Secure Architectures
Q59,"A company needs to provide its employees with secure access to confidential and sensitive files. The company wants to ensure that the files can be accessed only by authorized users. The files must be downloaded securely to the employees' devices. The files are stored in an on-premises Windows file server. However, due to an increase in remote usage, the file server is running out of capacity. Which solution will meet these requirements? the security group to limit inbound traffic to the employees' IP addresses. Integrate the Amazon FSx file system with the on-premises Active Directory. Configure AWS Client VPN. signed URL to allow download. employees to sign on with AWS IAM Identity Center (AWS Single Sign-On).",Migrate the file server to an Amazon EC2 instance in a public subnet. Configure,Migrate the files to an Amazon FSx for Windows File Server file system.,"Migrate the files to Amazon S3, and create a private VPC endpoint. Create a","Migrate the files to Amazon S3, and create a public VPC endpoint. Allow",,,B,"=IF(H60=I60,1,0)",Design Secure Architectures
Q60,A financial services company launched a new application that uses an Amazon RDS for MySQL database. The company uses the application to track stock market trends. The company needs to operate the application for only 2 hours at the end of each week. The company needs to optimize the cost of running the database. Which solution will meet these requirements MOST cost-effectively? MySQL database cluster. cluster. runs MySQL. Purchase an instance reservation for the EC2 instance. Service (Amazon ECS) cluster that uses MySQL container images to run tasks.,Migrate the existing RDS for MySQL database to an Aurora Serverless v2,Migrate the existing RDS for MySQL database to an Aurora MySQL database,Migrate the existing RDS for MySQL database to an Amazon EC2 instance that,Migrate the existing RDS for MySQL database to an Amazon Elastic Container,,,A,"=IF(H61=I61,1,0)",Design Cost-Optimized Architectures
Q61,A company has migrated an application to Amazon EC2 Linux instances. One of these EC2 instances runs several 1-hour tasks on a schedule. These tasks were written by different teams and have no common programming language. The 229 Global IT Certification Hub company is concerned about performance and scalability while these tasks run on a single instance. A solutions architect needs to implement a solution to resolve these concerns. Which solution will meet these requirements with the LEAST operational overhead? EventBridge (Amazon CloudWatch Events). container on demand to run the tasks as jobs. using Amazon EventBridge (Amazon CloudWatch Events). tasks. Create an Auto Scaling group with the AMI to run multiple copies of the instance.,Use AWS Batch to run the tasks as jobs. Schedule the jobs by using Amazon,Convert the EC2 instance to a container. Use AWS App Runner to create the,Copy the tasks into AWS Lambda functions. Schedule the Lambda functions by,Create an Amazon Machine Image (AMI) of the EC2 instance that runs the,,,A,"=IF(H62=I62,1,0)",Design High-Performing Architectures
Q62,A company is designing a tightly coupled high performance computing (HPC) environment in the AWS Cloud. The company needs to include features that will optimize the HPC environment for networking and storage. Which combination of solutions will meet these requirements? (Choose two.) the accelerator. scratch storage. to be HTTP and HTTPS. instances. 495 Global IT Certification Hub,Create an accelerator in AWS Global Accelerator. Configure custom routing for,Create an Amazon FSx for Lustre file system. Configure the file system with,Create an Amazon CloudFront distribution. Configure the viewer protocol policy,Launch Amazon EC2 instances. Attach an Elastic Fabric Adapter (EFA) to the,Create an AWS Elastic Beanstalk deployment to manage the environment.,,BD,"=IF(H63=I63,1,0)",Design High-Performing Architectures
Q63,"A solutions architect is creating an application that will handle batch processing of large amounts of data. The input data will be held in Amazon S3 and the output data will be stored in a different S3 bucket. For processing, the application will transfer the data over the network between multiple Amazon EC2 instances. What should the solutions architect do to reduce the overall data transfer costs?",Place all the EC2 instances in an Auto Scaling group.,Place all the EC2 instances in the same AWS Region.,Place all the EC2 instances in the same Availability Zone.,Place all the EC2 instances in private subnets in multiple Availability Zones.,,,C,"=IF(H64=I64,1,0)",Design Cost-Optimized Architectures
Q64,"A company runs an application in a private subnet behind an Application Load Balancer (ALB) in a VPC. The VPC has a NAT gateway and an internet gateway. The application calls the Amazon S3 API to store objects. According to the company's security policy, traffic from the application must not travel across the internet. Which solution will meet these requirements MOST cost-effectively? outbound traffic to Amazon S3. endpoint. assigned to the NAT gateway. is deployed. Update the VPC route table to use the second NAT gateway.",Configure an S3 interface endpoint. Create a security group that allows,Configure an S3 gateway endpoint. Update the VPC route table to use the,Configure an S3 bucket policy to allow traffic from the Elastic IP address that is,Create a second NAT gateway in the same subnet where the legacy application,,,B,"=IF(H65=I65,1,0)",Design Secure Architectures
Q65,"A company runs a fleet of web servers using an Amazon RDS for PostgreSQL DB instance. After a routine compliance check, the company sets a standard that requires a recovery point objective (RPO) of less than 1 second for all its production databases. Which solution meets these requirements? replicas in a separate Availability Zone. Database Migration Service (AWS DMS) change data capture (CDC) tasks.",Enable a Multi-AZ deployment for the DB instance.,Enable auto scaling for the DB instance in one Availability Zone.,"Configure the DB instance in one Availability Zone, and create multiple read","Configure the DB instance in one Availability Zone, and configure AWS",,,A,"=IF(H66=I66,1,0)",Design Resilient Architectures

SUMMARY,,,,,,,,Total Score:,=SUM(J2:J66),
,,,,,,,,Percentage:,=J68/65*100,
