Question,Question Text,A,B,C,D,E,Your Answer,Correct,Points,Domain
Q25,"A solutions architect wants to use the following JSON text as an identity-based policy to grant specific permissions: Which IAM principals can the solutions architect attach this policy to? (Choose two.) ( ""Statement"": [ ""Action"": [ ""asm:ListDocuments"", ""ssm:GetDocument"" ], ""Effect"": ""Allow"", ""Resource"": ""*"", GIC ""Sid"": -- } ], ""Version"": ""2012-10-17"" 264 Global IT Certification Hub",Role,Group,Organization,Amazon Elastic Container Service (Amazon ECS) resource,Amazon EC2 resource,,AB,"=IF(H26=I26,1,0)",Design Secure Architectures
Q26,A company runs a stateless web application in production on a group of Amazon EC2 On-Demand Instances behind an Application Load Balancer. The application experiences heavy usage during an 8-hour period each business day. Application usage is moderate and steady overnight. Application usage is low during weekends. The company wants to minimize its EC2 costs without affecting the availability of the application. Which solution will meet these requirements? any additional capacity that the application needs. for any additional capacity that the application needs. Instances for any additional capacity that the application needs.,Use Spot Instances for the entire workload.,Use Reserved Instances for the baseline level of usage. Use Spot instances for,Use On-Demand Instances for the baseline level of usage. Use Spot Instances,Use Dedicated Instances for the baseline level of usage. Use On-Demand,,,B,"=IF(H27=I27,1,0)",Design Resilient Architectures
Q27,A company has customers located across the world. The company wants to use automation to secure its systems and network infrastructure. The company's security team must be able to track and audit all incremental changes to the infrastructure. Which solution will meet these requirements? changes. changes. to track changes. Catalog to track changes.,Use AWS Organizations to set up the infrastructure. Use AWS Config to track,Use AWS CloudFormation to set up the infrastructure. Use AWS Config to track,Use AWS Organizations to set up the infrastructure. Use AWS Service Catalog,Use AWS CloudFormation to set up the infrastructure. Use AWS Service,,,B,"=IF(H28=I28,1,0)",Design Secure Architectures
Q28,A company deployed a serverless application that uses Amazon DynamoDB as a database layer. The application has experienced a large increase in users. The company wants to improve database response time from milliseconds to microseconds and to cache requests to the database. Which solution will meet these requirements with the LEAST operational overhead?,Use DynamoDB Accelerator (DAX).,Migrate the database to Amazon Redshift.,Migrate the database to Amazon RDS.,Use Amazon ElastiCache for Redis.,,,A,"=IF(H29=I29,1,0)",Design High-Performing Architectures
Q29,A media company has a multi-account AWS environment in the us-east-1 Region. The company has an Amazon Simple Notification Service (Amazon SNS) topic in a production account that publishes performance metrics. The company has an AWS Lambda function in an administrator account to process and analyze log data. The Lambda function that is in the administrator account must be invoked by messages from the SNS topic that is in the production account when significant metrics are reported. Which combination of steps will meet these requirements? (Choose two.) SNS to invoke the function. administrator account to buffer messages from the SNS topic that is in the production account. Configure the SQS queue to invoke the Lambda function. subscribe to the topic. topic notifications. Configure the EventBridge rule to forward notifications to the Lambda function that is in the administrator account. Use Amazon Athena to analyze the metrics from the administrator account.,Create an IAM resource policy for the Lambda function that allows Amazon,Implement an Amazon Simple Queue Service (Amazon SQS) queue in the,Create an IAM policy for the SNS topic that allows the Lambda function to,Use an Amazon EventBridge rule in the production account to capture the SNS,Store performance metrics in an Amazon S3 bucket in the production account.,,AC,"=IF(H30=I30,1,0)",Design High-Performing Architectures
Q30,A company is launching an application on AWS. The application uses an Application Load Balancer (ALB) to direct traffic to at least two Amazon EC2 instances in a single target group. The instances are in an Auto Scaling group for each environment. The company requires a development environment and a production environment. The production environment will have periods of high traffic. 150 Global IT Certification Hub Which solution will configure the development environment MOST cost-effectively? EC2 instance as a target. environment's Auto Scaling group.,Reconfigure the target group in the development environment to have only one,Change the ALB balancing algorithm to least outstanding requests.,Reduce the size of the EC2 instances in both environments.,Reduce the maximum number of EC2 instances in the development,,,D,"=IF(H31=I31,1,0)",Design Cost-Optimized Architectures
Q31,"A company is concerned that two NAT instances in use will no longer be able to support the traffic needed for the company's application. A solutions architect wants to implement a solution that is highly available, fault tolerant, and automatically scalable. What should the solutions architect recommend? same Availability Zone. different Availability Zones. different Availability Zones. Zones and deploy a Network Load Balancer.",Remove the two NAT instances and replace them with two NAT gateways in the,Use Auto Scaling groups with Network Load Balancers for the NAT instances in,Remove the two NAT instances and replace them with two NAT gateways in,Replace the two NAT instances with Spot Instances in different Availability,,,C,"=IF(H32=I32,1,0)",Design Resilient Architectures
Q32,A company is creating a new application that will store a large amount of data. The data will be analyzed hourly and will be modified by several Amazon EC2 Linux instances that are deployed across multiple Availability Zones. The needed amount of storage space will continue to grow for the next 6 months. Which storage solution should a solutions architect recommend to meet these requirements? allow access to the application instances. the EBS volume on the application instances. Mount the file system on the application instances. IOPS volume shared between the application instances.,Store the data in Amazon S3 Glacier. Update the S3 Glacier vault policy to,Store the data in an Amazon Elastic Block Store (Amazon EBS) volume. Mount,Store the data in an Amazon Elastic File System (Amazon EFS) file system.,Store the data in an Amazon Elastic Block Store (Amazon EBS) Provisioned,,,C,"=IF(H33=I33,1,0)",Design Resilient Architectures
Q33,"A company has deployed a multiplayer game for mobile devices. The game requires live location tracking of players based on latitude and longitude. The data store for the game must support rapid updates and retrieval of locations. The game uses an Amazon RDS for PostgreSQL DB instance with read replicas to store the location data. During peak usage periods, the database is unable to maintain the performance that is needed for reading and writing updates. The game's user base is increasing rapidly. What should a solutions architect do to improve the performance of the data tier? 451 Global IT Certification Hub Multi-AZ enabled. Dashboards. instance. Modify the game to use DAX. on instance. Modify the game to use Redis.",Take a snapshot of the existing DB instance. Restore the snapshot with,Migrate from Amazon RDS to Amazon OpenSearch Service with OpenSearch,Deploy Amazon DynamoDB Accelerator (DAX) in front of the existing DB,Deploy an Amazon ElastiCache for Redis cluster in front of the existing DB,,,D,"=IF(H34=I34,1,0)",Design Resilient Architectures
Q34,A financial company needs to handle highly sensitive data. The company will store the data in an Amazon S3 bucket. The company needs to ensure that the data is encrypted in transit and at rest. The company must manage the encryption keys outside the AWS Cloud. Which solution will meet these requirements? an AWS Key Management Service (AWS KMS) customer managed key. 499 Global IT Certification Hub an AWS Key Management Service (AWS KMS) AWS managed key. bucket.,Encrypt the data in the S3 bucket with server-side encryption (SSE) that uses,Encrypt the data in the S3 bucket with server-side encryption (SSE) that uses,Encrypt the data in the S3 bucket with the default server-side encryption (SSE).,Encrypt the data at the company's data center before storing the data in the S3,,,D,"=IF(H35=I35,1,0)",Design Secure Architectures
Q35,"A company hosts its application in the AWS Cloud. The application runs on Amazon EC2 instances behind an Elastic Load Balancer in an Auto Scaling group 271 Global IT Certification Hub and with an Amazon DynamoDB table. The company wants to ensure the application can be made available in anotherAWS Region with minimal downtime. What should a solutions architect do to meet these requirements with the LEAST amount of downtime? Region. Configure the DynamoDB table as a global table. Configure DNS failover to point to the new disaster recovery Region's load balancer. balancers, and DynamoDB tables to be launched when needed Configure DNS failover to point to the new disaster recovery Region's load balancer. balancer to be launched when needed. Configure the DynamoDB table as a global table. Configure DNS failover to point to the new disaster recovery Region's load balancer. Region. Configure the DynamoDB table as a global table. Create an Amazon CloudWatch alarm to trigger an AWS Lambda function that updates Amazon Route 53 pointing to the disaster recovery load balancer.",Create an Auto Scaling group and a load balancer in the disaster recovery,"Create an AWS CloudFormation template to create EC2 instances, load",Create an AWS CloudFormation template to create EC2 instances and a load,Create an Auto Scaling group and load balancer in the disaster recovery,,,A,"=IF(H36=I36,1,0)",Design Resilient Architectures
Q36,"A company has migrated multiple Microsoft Windows Server workloads to Amazon EC2 instances that run in the us-west-1 Region. The company manually 319 Global IT Certification Hub backs up the workloads to create an image as needed. In the event of a natural disaster in the us-west-1 Region, the company wants to recover workloads quickly in the us-west-2 Region. The company wants no more than 24 hours of data loss on the EC2 instances. The company also wants to automate any backups of the EC2 instances. Which solutions will meet these requirements with the LEAST administrative effort? (Choose two.) to create a backup based on tags. Schedule the backup to run twice daily. Copy the image on demand. to create a backup based on tags. Schedule the backup to run twice daily. Configure the copy to the us-west-2 Region. Create a backup plan for the EC2 instances based on tag values. Create an AWS Lambda function to run as a scheduled job to copy the backup data to us-west-2. backup plan for the EC2 instances based on tag values. Define the destination for the copy as us-west-2. Specify the backup schedule to run twice daily. backup plan for the EC2 instances based on tag values. Specify the backup schedule to run twice daily. Copy on demand to us-west-2.",Create an Amazon EC2-backed Amazon Machine Image (AMI) lifecycle policy,Create an Amazon EC2-backed Amazon Machine Image (AMI) lifecycle policy,Create backup vaults in us-west-1 and in us-west-2 by using AWS Backup.,Create a backup vault by using AWS Backup. Use AWS Backup to create a,Create a backup vault by using AWS Backup. Use AWS Backup to create a,,BD,"=IF(H37=I37,1,0)",Design Resilient Architectures
Q37,A company is deploying a new public web application to AWS. The application will run behind an Application Load Balancer (ALB). The application needs to be encrypted at the edge with an SSL/TLS certificate that is issued by an external certificate authority (CA). The certificate must be rotated each year before the certificate expires. What should a solutions architect do to meet these requirements? certificate to the ALB. Use the managed renewal feature to automatically rotate the certificate. the key material from the certificate. Apply the certificate to the ALUse the managed renewal feature to automatically rotate the certificate. SSL/TLS certificate from the root CA. Apply the certificate to the ALB. Use the managed renewal feature to automatically rotate the certificate. the certificate to the ALB. Use Amazon EventBridge (Amazon CloudWatch Events) to send a notification when the certificate is nearing expiration. Rotate the certificate manually.,Use AWS Certificate Manager (ACM) to issue an SSL/TLS certificate. Apply the,Use AWS Certificate Manager (ACM) to issue an SSL/TLS certificate. Import,Use AWS Certificate Manager (ACM) Private Certificate Authority to issue an,Use AWS Certificate Manager (ACM) to import an SSL/TLS certificate. Apply,,,D,"=IF(H38=I38,1,0)",Design Secure Architectures
Q38,"A company wants to build a scalable key management infrastructure to support developers who need to encrypt data in their applications. What should a solutions architect do to reduce the operational burden? 75 Global IT Certification Hub encryption keys. protect the encryption keys. 9n,",Use multi-factor authentication (MFA) to protect the encryption keys.,Use AWS Key Management Service (AWS KMS) to protect the encryption keys.,"Use AWS Certificate Manager (ACM) to create, store, and assign the",Use an IAM policy to limit the scope of users who have access permissions to,,,B,"=IF(H39=I39,1,0)",Design Secure Architectures
Q39,"A large company wants to provide its globally located developers separate, limited size, managed PostgreSQL databases for development purposes. The databases will be low volume. The developers need the databases only when they are actively working. Which solution will meet these requirements MOST cost-effectively? Set up a process to shut down Aurora instances at the end of the workday and to start Aurora instances at the beginning of the next workday. launching Amazon Aurora instances. Give the developers access to launch the product when they need a development database. product to launch databases in the cluster with the default capacity settings. Grant the developers access to the product. a process to terminate identified idle RDS databases. 531 Global IT Certification Hub",Give the developers the ability to launch separate Amazon Aurora instances.,Develop an AWS Service Catalog product that enforces size restrictions for,Create an Amazon Aurora Serverless cluster. Develop an AWS Service Catalog,Monitor AWS Trusted Advisor checks for idle Amazon RDS databases. Create,,,C,"=IF(H40=I40,1,0)",Design Cost-Optimized Architectures
Q40,"An online gaming company is transitioning user data storage to Amazon DynamoDB to support the company's growing user base. The current architecture includes DynamoDB tables that contain user profiles, achievements, and in-game transactions. The company needs to design a robust, continuously available, and resilient DynamoDB architecture to maintain a seamless gaming experience for users. Which solution will meet these requirements MOST cost-effectively? mode. Use global tables to replicate data across multiple Regions. tables in a single AWS Region and enable auto scaling. Configure Cross-Region Replication manually to additional Regions. mode. Use DynamoDB Streams for Cross-Region Replication between Regions. tables in multiple AWS Regions. Use provisioned capacity mode. Enable auto scaling.",Create DynamoDB tables in a single AWS Region. Use on-demand capacity,Use DynamoDB Accelerator (DAX) to cache frequently accessed data. Deploy,Create DynamoDB tables in multiple AWS Regions. Use on-demand capacity,Use DynamoDB global tables for automatic multi-Region replication. Deploy,,,D,"=IF(H41=I41,1,0)",Design Cost-Optimized Architectures
Q41,A company is migrating its databases to Amazon RDS for PostgreSQL. The company is migrating its applications to Amazon EC2 instances. The company wants to optimize costs for long-running workloads. Which solution will meet this requirement MOST cost-effectively? Purchase a 1 year Compute Savings Plan with the No Upfront option for the EC2 588 Global IT Certification Hub instances. the Amazon RDS for PostgreSQL workloads. Purchase a 1 year EC2 Instance Savings Plan with the No Upfront option for the EC2 instances. for the Amazon RDS for PostgreSQL workloads. Purchase a 1 year EC2 Instance Savings Plan with the Partial Upfront option for the EC2 instances. the Amazon RDS for PostgreSQL workloads. Purchase a 3 year EC2 Instance Savings Plan with the All Upfront option for the EC2 instances.,Use On-Demand Instances for the Amazon RDS for PostgreSQL workloads.,Purchase Reserved Instances for a 1 year term with the No Upfront option for,Purchase Reserved Instances for a 1 year term with the Partial Upfront option,Purchase Reserved Instances for a 3 year term with the All Upfront option for,,,D,"=IF(H42=I42,1,0)",Design Cost-Optimized Architectures
Q42,"A company is launching a new application deployed on an Amazon Elastic Container Service (Amazon ECS) cluster and is using the Fargate launch type for ECS tasks. The company is monitoring CPU and memory usage because it is expecting high traffic to the application upon its launch. However, the company wants to reduce costs when utilization decreases. What should a solutions architect recommend? traffic patterns. that trigger an Amazon CloudWatch alarm. metric breaches trigger an Amazon CloudWatch alarm. ECS metric breaches trigger an Amazon CloudWatch alarm.",Use Amazon EC2 Auto Scaling to scale at certain periods based on previous,Use an AWS Lambda function to scale Amazon ECS based on metric breaches,Use Amazon EC2 Auto Scaling with simple scaling policies to scale when ECS,Use AWS Application Auto Scaling with target tracking policies to scale when,,,D,"=IF(H43=I43,1,0)",Design Cost-Optimized Architectures
Q43,An application allows users at a company's headquarters to access product data. The product data is stored in an Amazon RDS MySQL DB instance. The operations team has isolated an application performance slowdown and wants to separate read traffic from write traffic. A solutions architect needs to optimize the application's performance quickly. What should the solutions architect recommend? requests from the primary Availability Zone. requests from the secondary Availability Zone. the compute and storage resources as the source database. same compute and storage resources as the source database.,Change the existing database to a Multi-AZ deployment. Serve the read,Change the existing database to a Multi-AZ deployment. Serve the read,Create read replicas for the database. Configure the read replicas with half of,Create read replicas for the database. Configure the read replicas with the,,,D,"=IF(H44=I44,1,0)",Design Resilient Architectures
Q44,An application running on an Amazon EC2 instance in VPC-A needs to access files in another EC2 instance in VPC-B. Both VPCs are in separate AWS accounts. The network administrator needs to design a solution to configure secure access to EC2 instance in VPC-B from VPC-A. The connectivity should not have a single point of failure or bandwidth concerns. Which solution will meet these requirements? and add appropriate routes from VPC-A.,Set up a VPC peering connection between VPC-A and VPC-B.,Set up VPC gateway endpoints for the EC2 instance running in VPC-B.,Attach a virtual private gateway to VPC-B and set up routing from VPC-A.,Create a private virtual interface (VIF) for the EC2 instance running in VPC-B,,,A,"=IF(H45=I45,1,0)",Design Secure Architectures
Q45,"A company wants to build a web application on AWS. Client access requests to the website are not predictable and can be idle for a long time. Only customers who have paid a subscription fee can have the ability to sign in and use the web 340 Global IT Certification Hub application. Which combination of steps will meet these requirements MOST cost-effectively? (Choose three.) DynamoDB. Create an Amazon API Gateway endpoint to accept RESTful APIs. Send the API calls to the Lambda function. Application Load Balancer to retrieve user information from Amazon RDS. Create an Amazon API Gateway endpoint to accept RESTful APIs. Send the API calls to the Lambda function. Use an integrated Amazon CloudFront configuration. F. Use Amazon S3 static web hosting with PHP, CSS, and JS. Use Amazon CloudFront to serve the frontend web content.",Create an AWS Lambda function to retrieve user information from Amazon,Create an Amazon Elastic Container Service (Amazon ECS) service behind an,Create an Amazon Cognito user pool to authenticate users.,Create an Amazon Cognito identity pool to authenticate users.,"Use AWS Amplify to serve the frontend web content with HTML, CSS, and JS.",,ACE,"=IF(H46=I46,1,0)",Design High-Performing Architectures
Q46,"A company wants to use high performance computing (HPC) infrastructure on AWS for financial risk modeling. The company's HPC workloads run on Linux. Each HPC workflow runs on hundreds of Amazon EC2 Spot Instances, is short-lived, and generates thousands of output files that are ultimately stored in persistent storage for analytics and long-term future use. The company seeks a cloud storage solution that permits the copying of on-premises data to long-term persistent storage to make data available for processing by all EC2 instances. The solution should also be a high performance 99 Global IT Certification Hub file system that is integrated with persistent storage to read and write datasets and output files. Which combination of AWS services meets these requirements? Block Store (Amazon EBS) General Purpose SSD (gp2) volume",Amazon FSx for Lustre integrated with Amazon S3,Amazon FSx for Windows File Server integrated with Amazon S3,Amazon S3 Glacier integrated with Amazon Elastic Block Store (Amazon EBS),Amazon S3 bucket with a VPC endpoint integrated with an Amazon Elastic,,,A,"=IF(H47=I47,1,0)",Design High-Performing Architectures
Q47,"A company hosts its multi-tier applications on AWS. For compliance, governance, auditing, and security, the company must track configuration changes on its AWS resources and record a history of API calls made to these resources. What should a solutions architect do to meet these requirements? API calls. API calls. record API calls. to record API calls.",Use AWS CloudTrail to track configuration changes and AWS Config to record,Use AWS Config to track configuration changes and AWS CloudTrail to record,Use AWS Config to track configuration changes and Amazon CloudWatch to,Use AWS CloudTrail to track configuration changes and Amazon CloudWatch,,,B,"=IF(H48=I48,1,0)",Design Secure Architectures
Q48,A weather forecasting company needs to process hundreds of gigabytes of data with sub-millisecond latency. The company has a high performance computing (HPC) environment in its data center and wants to expand its forecasting capabilities. A solutions architect must identify a highly available cloud storage solution that can handle large amounts of sustained throughput. Files that are stored in the solution should be accessible to thousands of compute instances that will simultaneously access and process the entire dataset. What should the solutions architect do to meet these requirements? mode. mode.,Use Amazon FSx for Lustre scratch file systems.,Use Amazon FSx for Lustre persistent file systems.,Use Amazon Elastic File System (Amazon EFS) with Bursting Throughput,Use Amazon Elastic File System (Amazon EFS) with Provisioned Throughput,,,B,"=IF(H49=I49,1,0)",Design High-Performing Architectures
Q49,"A company runs an on-premises application that is powered by a MySQL database. The company is migrating the application to AWS to increase the application's elasticity and availability. The current architecture shows heavy read activity on the database during times of normal operation. Every 4 hours, the company's development team pulls a full 57 Global IT Certification Hub export of the production database to populate a database in the staging environment. During this period, users experience unacceptable application latency. The development team is unable to use the staging environment until the procedure completes. A solutions architect must recommend replacement architecture that alleviates the application latency issue. The replacement architecture also must give the development team the ability to continue using the staging environment without delay. Which solution meets these requirements? Populate the staging database by implementing a backup and restore process that uses the mysqldump utility. database cloning to create the staging database on-demand. production. Use the standby instance for the staging database. production. Populate the staging database by implementing a backup and restore process that uses the mysqldump utility.",Use Amazon Aurora MySQL with Multi-AZ Aurora Replicas for production.,Use Amazon Aurora MySQL with Multi-AZ Aurora Replicas for production. Use,Use Amazon RDS for MySQL with a Multi-AZ deployment and read replicas for,Use Amazon RDS for MySQL with a Multi-AZ deployment and read replicas for,,,B,"=IF(H50=I50,1,0)",Design Resilient Architectures
